<?xml version="1.0" encoding="utf-8"?>
<!DOCTYPE keyboard SYSTEM "VirtualKeyboardLayout.dtd">

<keyboard title="Toolbar" version="1.0">
  <layout type="general">
    <section id="main">
      <row>
        <key>
          <binding action="left" label="←" />
        </key>
        <key>
          <binding action="right" label="→" />
        </key>
      </row>
    </section>
  </layout>
</keyboard>
