<?xml version="1.0" encoding="utf-8"?>
<!DOCTYPE keyboard SYSTEM "VirtualKeyboardLayout.dtd">

<keyboard catalog="" language="uk" title="Українська" version="1.0">
  <layout type="general">
    <section id="main">
      <row>
        <key>
          <binding label="й">
            <modifiers keys="shift">
              <binding label="Й" />
            </modifiers>
          </binding>
        </key>
        <key>
          <binding label="ц">
            <modifiers keys="shift">
              <binding label="Ц" />
            </modifiers>
          </binding>
        </key>
        <key>
          <binding label="у">
            <modifiers keys="shift">
              <binding label="У" />
            </modifiers>
          </binding>
        </key>
        <key>
          <binding label="к">
            <modifiers keys="shift">
              <binding label="К" />
            </modifiers>
          </binding>
        </key>
        <key>
          <binding label="е">
            <modifiers keys="shift">
              <binding label="Е" />
            </modifiers>
          </binding>
        </key>
        <key>
          <binding label="н">
            <modifiers keys="shift">
              <binding label="Н" />
            </modifiers>
          </binding>
        </key>
        <key>
          <binding label="г">
            <modifiers keys="shift">
              <binding label="Г" />
            </modifiers>
          </binding>
        </key>
        <key>
          <binding label="ш">
            <modifiers keys="shift">
              <binding label="Ш" />
            </modifiers>
          </binding>
        </key>
        <key>
          <binding label="щ">
            <modifiers keys="shift">
              <binding label="Щ" />
            </modifiers>
          </binding>
        </key>
        <key>
          <binding label="з">
            <modifiers keys="shift">
              <binding label="З" />
            </modifiers>
          </binding>
        </key>
        <key>
          <binding label="х">
            <modifiers keys="shift">
              <binding label="Х" />
            </modifiers>
          </binding>
        </key>
      </row>
      <row>
        <key>
          <binding label="ф">
            <modifiers keys="shift">
              <binding label="Ф" />
            </modifiers>
          </binding>
        </key>
        <key>
          <binding label="і">
            <modifiers keys="shift">
              <binding label="І" />
            </modifiers>
          </binding>
        </key>
        <key>
          <binding label="в">
            <modifiers keys="shift">
              <binding label="В" />
            </modifiers>
          </binding>
        </key>
        <key>
          <binding label="а">
            <modifiers keys="shift">
              <binding label="А" />
            </modifiers>
          </binding>
        </key>
        <key>
          <binding label="п">
            <modifiers keys="shift">
              <binding label="П" />
            </modifiers>
          </binding>
        </key>
        <key>
          <binding label="р">
            <modifiers keys="shift">
              <binding label="Р" />
            </modifiers>
          </binding>
        </key>
        <key>
          <binding label="о">
            <modifiers keys="shift">
              <binding label="О" />
            </modifiers>
          </binding>
        </key>
        <key>
          <binding label="л">
            <modifiers keys="shift">
              <binding label="Л" />
            </modifiers>
          </binding>
        </key>
        <key>
          <binding label="д">
            <modifiers keys="shift">
              <binding label="Д" />
            </modifiers>
          </binding>
        </key>
        <key>
          <binding label="ж">
            <modifiers keys="shift">
              <binding label="Ж" />
            </modifiers>
          </binding>
        </key>
        <key>
          <binding label="є">
            <modifiers keys="shift">
              <binding label="Є" />
            </modifiers>
          </binding>
        </key>
      </row>
      <row>
        <key style="special">
          <binding action="shift" />
        </key>
        <key>
          <binding label="ґ">
            <modifiers keys="shift">
              <binding label="Ґ" />
            </modifiers>
          </binding>
        </key>
        <key>
          <binding label="я">
            <modifiers keys="shift">
              <binding label="Я" />
            </modifiers>
          </binding>
        </key>
        <key>
          <binding label="ч">
            <modifiers keys="shift">
              <binding label="Ч" />
            </modifiers>
          </binding>
        </key>
        <key>
          <binding label="с">
            <modifiers keys="shift">
              <binding label="С" />
            </modifiers>
          </binding>
        </key>
        <key>
          <binding label="м">
            <modifiers keys="shift">
              <binding label="М" />
            </modifiers>
          </binding>
        </key>
        <key>
          <binding label="и">
            <modifiers keys="shift">
              <binding label="И" />
            </modifiers>
          </binding>
        </key>
        <key>
          <binding label="т">
            <modifiers keys="shift">
              <binding label="Т" />
            </modifiers>
          </binding>
        </key>
        <key>
          <binding label="ь">
            <modifiers keys="shift">
              <binding label="Ь" />
            </modifiers>
          </binding>
        </key>
        <key>
          <binding label="б">
            <modifiers keys="shift">
              <binding label="Б" />
            </modifiers>
          </binding>
        </key>
        <key style="special">
          <binding action="backspace" />
        </key>
      </row>
      <row>
        <key style="special" width="large">
          <binding action="sym" label="?123" />
        </key>
        <key>
          <binding label="ї">
            <modifiers keys="shift">
              <binding label="Ї" />
            </modifiers>
          </binding>
        </key>
        <key id="emailUrlKey">
          <binding label="," />
        </key>
        <key width="xx-large">
          <binding action="space" label="" />
        </key>
        <key>
          <binding label="." />
        </key>
        <key>
          <binding label="ю">
            <modifiers keys="shift">
              <binding label="Ю" />
            </modifiers>
          </binding>
        </key>
        <key id="actionKey" style="special" width="x-large">
          <binding action="return" />
        </key>
      </row>
    </section>
  </layout>
  <import file="symbols_ru_uk.xml" />
</keyboard>
