<?xml version="1.0" encoding="utf-8"?>
<!DOCTYPE keyboard SYSTEM "VirtualKeyboardLayout.dtd">

<keyboard catalog="symbols" version="1.0">
  <layout type="general">
    <section id="symbols0" type="non-sloppy">
      <row>
        <key>
          <binding label="1" />
        </key>
        <key>
          <binding label="2" />
        </key>
        <key>
          <binding label="3" />
        </key>
        <key>
          <binding label="4" />
        </key>
        <key>
          <binding label="5" />
        </key>
        <key>
          <binding label="6" />
        </key>
        <key>
          <binding label="7" />
        </key>
        <key>
          <binding label="8" />
        </key>
        <key>
          <binding label="9" />
        </key>
        <key>
          <binding label="0" />
        </key>
      </row>
      <row>
        <spacer />
        <key>
          <binding label="*" />
        </key>
        <key>
          <binding label="#" />
        </key>
        <key>
          <binding label="+" />
        </key>
        <key>
          <binding label="-" />
        </key>
        <key>
          <binding label="=" />
        </key>
        <key>
          <binding label="(" />
        </key>
        <key>
          <binding label=")" />
        </key>
        <key>
          <binding label="!" />
        </key>
        <key>
          <binding label="?" />
        </key>
        <spacer />
      </row>
      <row>
        <key style="special" width="large">
          <binding action="switch" label="1/2" />
        </key>
        <spacer />
        <key>
          <binding label="@" quickpick="true" />
        </key>
        <key>
          <binding label="~" />
        </key>
        <key>
          <binding label="/" />
        </key>
        <key>
          <binding label="\" />
        </key>
        <key>
          <binding label="'" quickpick="true" />
        </key>
        <key>
          <binding label=";" />
        </key>
        <key>
          <binding label=":" />
        </key>
        <spacer />
        <key style="special" width="large">
          <binding action="backspace" />
        </key>
      </row>
      <row>
        <key style="special" width="x-large">
          <binding action="sym" label="ABC" />
        </key>
        <spacer />
        <key>
          <binding label="," />
        </key>
        <key width="xx-large">
          <binding action="space" />
        </key>
        <key>
          <binding label="." />
        </key>
        <spacer />
        <key id="actionKey" style="special" width="x-large">
          <binding action="return" />
        </key>
      </row>
    </section>
    <section id="symbols1" type="non-sloppy">
      <row>
        <key>
          <binding label="€" />
        </key>
        <key>
          <binding label="£" />
        </key>
        <key>
          <binding label="$" />
        </key>
        <key>
          <binding label="¥" />
        </key>
        <key>
          <binding label="₹" />
        </key>
        <key>
          <binding label="%" />
        </key>
        <key>
          <binding label="&lt;" />
        </key>
        <key>
          <binding label="&gt;" />
        </key>
        <key>
          <binding label="[" />
        </key>
        <key>
          <binding label="]" />
        </key>
      </row>
      <row>
        <spacer />
        <key>
          <binding label="`" />
        </key>
        <key>
          <binding label="^" />
        </key>
        <key>
          <binding label="|" />
        </key>
        <key>
          <binding label="_" />
        </key>
        <key>
          <binding label="§" />
        </key>
        <key>
          <binding label="{" />
        </key>
        <key>
          <binding label="}" />
        </key>
        <key>
          <binding label="¡" />
        </key>
        <key>
          <binding label="¿" />
        </key>
        <spacer />
      </row>
      <row>
        <key style="special" width="large">
          <binding action="switch" label="2/2" />
        </key>
        <spacer />
        <key>
          <binding label="«" />
        </key>
        <key>
          <binding label="»" />
        </key>
        <key>
          <binding label="&quot;" />
        </key>
        <key>
          <binding label="“" />
        </key>
        <key>
          <binding label="”" />
        </key>
        <key>
          <binding label="„" />
        </key>
        <key>
          <binding label="&amp;" />
        </key>
        <spacer />
        <key style="special" width="large">
          <binding action="backspace" />
        </key>
      </row>
      <row>
        <key style="special" width="x-large">
          <binding action="sym" label="ABC" />
        </key>
        <spacer />
        <key>
          <binding label="," />
        </key>
        <key width="xx-large">
          <binding action="space" />
        </key>
        <key>
          <binding label="." />
        </key>
        <spacer />
        <key id="actionKey" style="special" width="x-large">
          <binding action="return" />
        </key>
      </row>
    </section>
  </layout>
</keyboard>
