<?xml version="1.0" encoding="utf-8"?>
<!DOCTYPE keyboard SYSTEM "VirtualKeyboardLayout.dtd">

<keyboard catalog="phonenumber" title="Phone Number" version="1.0">
  <layout orientation="landscape" type="phonenumber">
    <section id="main" movable="false">
      <row height="x-large">
        <key>
          <binding label="1" />
        </key>
        <key>
          <binding label="2" secondary_label="abc" />
        </key>
        <key>
          <binding label="3" secondary_label="def" />
        </key>
        <key>
          <binding label="4" secondary_label="ghi" />
        </key>
        <key>
          <binding label="5" secondary_label="jkl" />
        </key>
        <key>
          <binding label="6" secondary_label="mno" />
        </key>
        <key>
          <binding label="7" secondary_label="pqrs" />
        </key>
        <key>
          <binding label="8" secondary_label="tuv" />
        </key>
        <key>
          <binding label="9" secondary_label="wxyz" />
        </key>
        <key>
          <binding label="0" />
        </key>
      </row>
      <row>
        <spacer />
        <key width="large">
          <binding action="cycle" cycleset="*+p" label="*+" />
        </key>
        <key width="large">
          <binding label="#" />
        </key>
        <key style="special" width="large">
          <binding action="backspace" label="" />
        </key>
        <key id="actionKey" style="special" width="large">
          <binding action="return" />
        </key>
      </row>
    </section>
  </layout>
  <layout orientation="portrait" type="phonenumber">
    <section id="main" movable="false">
      <row>
        <key>
          <binding label="1" />
        </key>
        <key>
          <binding label="2" secondary_label="abc" />
        </key>
        <key>
          <binding label="3" secondary_label="def" />
        </key>
      </row>
      <row>
        <key>
          <binding label="4" secondary_label="ghi" />
        </key>
        <key>
          <binding label="5" secondary_label="jkl" />
        </key>
        <key>
          <binding label="6" secondary_label="mno" />
        </key>
      </row>
      <row>
        <key>
          <binding label="7" secondary_label="pqrs" />
        </key>
        <key>
          <binding label="8" secondary_label="tuv" />
        </key>
        <key>
          <binding label="9" secondary_label="wxyz" />
        </key>
      </row>
      <row>
        <key>
          <binding action="cycle" cycleset="*+p" label="*+" />
        </key>
        <key>
          <binding label="0" />
        </key>
        <key>
          <binding label="#" />
        </key>
      </row>
      <row>
        <key style="special" width="large">
          <binding action="backspace" label="" />
        </key>
        <spacer />
        <key id="actionKey" style="special">
          <binding action="return" />
        </key>
      </row>
    </section>
  </layout>
</keyboard>
