<?xml version="1.0" encoding="utf-8"?>
<!DOCTYPE keyboard SYSTEM "VirtualKeyboardLayout.dtd">

<keyboard catalog="number" title="Number" version="1.0">
  <layout orientation="landscape" type="number">
    <section id="main" movable="false">
      <row>
        <key width="x-large">
          <binding label="1" />
        </key>
        <key width="x-large">
          <binding label="2" />
        </key>
        <key width="x-large">
          <binding label="3" />
        </key>
      </row>
      <row>
        <key width="x-large">
          <binding label="4" />
        </key>
        <key width="x-large">
          <binding label="5" />
        </key>
        <key width="x-large">
          <binding label="6" />
        </key>
      </row>
      <row>
        <key width="x-large">
          <binding label="7" />
        </key>
        <key width="x-large">
          <binding label="8" />
        </key>
        <key width="x-large">
          <binding label="9" />
        </key>
      </row>
      <row>
        <key width="x-large">
          <binding action="plus_minus_toggle" label="+/-" />
        </key>
        <key width="x-large">
          <binding label="0" />
        </key>
        <key style="special" width="x-large">
          <binding action="backspace" label="" />
        </key>
      </row>
    </section>
  </layout>
  <layout orientation="portrait" type="number">
    <section id="main" movable="false">
      <row>
        <key>
          <binding label="1" />
        </key>
        <key>
          <binding label="2" />
        </key>
        <key>
          <binding label="3" />
        </key>
      </row>
      <row>
        <key>
          <binding label="4" />
        </key>
        <key>
          <binding label="5" />
        </key>
        <key>
          <binding label="6" />
        </key>
      </row>
      <row>
        <key>
          <binding label="7" />
        </key>
        <key>
          <binding label="8" />
        </key>
        <key>
          <binding label="9" />
        </key>
      </row>
      <row>
        <key>
          <binding action="plus_minus_toggle" label="+/-" />
        </key>
        <key>
          <binding label="0" />
        </key>
        <key>
          <binding action="decimal_separator" />
        </key>
      </row>
      <row>
        <key style="special" width="large">
          <binding action="backspace" label="" />
        </key>
        <spacer />
        <key id="actionKey" style="special">
          <binding action="return" />
        </key>
      </row>
    </section>
  </layout>
</keyboard>
